Знаки Зодиака;sun;ascendant;moon;mercury;venus;mars;jupiter;saturn;uranus;neptune;pluto
Весы;Характеристика представителей Солнечного знака Весов говорит о том что они обладают высоким уровнем интуитивного интеллекта. Они прекрасные собеседники, их дружелюбию и тонкому чувству юмора можно позавидовать. С окружающими Весы ведут себя довольно открыто и вместе тем мягко, не допуская неосторожных высказываний и стараясь не обижать близких. В обществе Весы производят впечатление активных, удачливых людей, однако не все так просто: натура этих воздушных людей весьма противоречива, и временами они сами от этого страдают.;Врожденное чувство справедливости и тонкое художественное чутье тянет его к высокоразвитым культурным людям, даже если волей судьбы он родился в низших социальных кругах. В поисках истины проявляет упрямство, доверяя интуиции, а не опыту других. Обладатель Асцендента в Весах прекрасно разбирается в человеческой психологии, ценит красоту души не меньше внешней формы. Чувство стиля проявляется в изысканном обустройстве жилища, необычной цветовой гамме одежды, в прекрасных манерах и красноречии.;Люди рожденные с Луной в Весах добры, отзывчивы, приятны, оптимистичны, честны и увлекаются социальными вопросами. Вы – тактичный и заботливый друг и можете сделать все, чтобы другие люди были приняты и оценены по достоинству. В то же время, скорее всего, вы обладаете здравым рассудком, способны делать правильные выводы.;Люди рожденные с Меркурием в Весах, способны видеть проблему со всех сторон, вести переговоры и добиваться компромисса и примирения. Вы дипломатичны, справедливы, тактичны и обладаете социальным тактом.;Люди рожденные с Венерой в знаке Весов очаровательны, тактичны, вежливы, внимательны, сбалансированы, гармоничны. У них есть огромное желание нравиться всем и не создавать никаких изменений.;Люди рожденные с Марсом в Весах часто колеблются между своей напористостью, агрессивностью и желанием сделать вещи по-своему, и одновременно хотят угодить всем и пойти на компромисс.;Люди рожденные с Юпитером в Весах, очень симпатичны и дружелюбны, являются настоящими философами. Вы расширяете свой кругозор и растете за счет того, что используете вашу способность быть любимыми. Можете поощрять других и активизировать их усилия. ;Люди рожденные с Сатурном в Весах настоящие дипломаты, тактичны и принимают сбалансированные решения, которые могут внушить доверие. Они нуждаются в сотрудничестве с другими людьми, гармонии, терпении и любви.;;;
Скорпион;Скорпион – это самый таинственный и непонятный для окружающих знак Зодиака. Характеристика Скорпионов говорит что среди них можно встретить и великих гуманистов, и законченных эгоистов, материалистов и романтиков, обладателей колоссального интеллекта и очень глупых людей. Всегда известно лишь одно: рядом с этим знаком нужно быть внимательным и осторожным, поскольку его действия трудно предугадать.;Натив рождается темноволосым, вне зависимости от генотипа родителей. Со временем волосы могут поменять цвет вплоть до светло-русого, но 90% восходящих Скорпионов в первые недели жизни смуглые брюнеты. Если Солнце в огненных знаках, то роды происходят стремительно, иногда с оперативным вмешательством или внушительной кровопотерей матери.;Люди рожденный с Луной под знаком скорпиона, как правило скрытны и склонны размышлять в тишине над проблемами, которые доставили им в реальности или просто в вашем вымышленном мире. Разумная и эмоциональная деятельность может быть направлена на чувства, секс или смерть.;Люди родившиеся с Меркурием в Скорпионе имеют превосходную умственную концентрацию и способность полностью погружаться в свою работу. Вы любите разгадывать загадки и вы прирожденный детектив.;В вопросах любви люди, рожденные с Венерой под знаком Скорпиона, жаждут глубоких, пылких и страстных отношений. Связи, которые вы поддерживаете, достаточно эмоциональны и даже могут рассматриваться как собственнические.;юди рожденные с Марсом в Скорпионе чрезвычайно волевые и преследуют свои цели, и желания со страстной самоотдачей и решимостью. Вы способны на полную концентрацию и жесткую дисциплину.;Люди рожденные с Юпитером в Скорпионе, эффективны и трудолюбивы, с талантом к бизнесу и финансам. Вы находчивы и готовы сделать всю работу необходимую для выполнения задачи.;Люди рожденные с Сатурном в Скорпионе могут быть очень дисциплинированными. У вас есть исполнительские таланты, проницательность и чрезвычайные способности. Вы можете иметь экстрасенсорные способности.;;;
Стрелец;Стрелец – это полноправный представитель огненной стихии, и его взрывной темперамент становится тому подтверждением. Этот знак является примером гармоничного сочетания внутренней и внешней энергии. Характеристика Солнечного Стрельца показывает что он открыт к общению и дружелюбен с окружающими, что заслуженно дает ему звание любимца публики. Вместе с тем это довольно свободолюбивый тип, который болезненно воспринимает любые покушения на собственную свободу.;Обладатели Асцендента в Стрельце отличные организаторы и руководители. Лидерство для подопечных Юпитера означает всеобщее уважение и преклонение перед их опытом. Эти два чувства вдохновляют на победы над ленью ради поддержания личного престижа в обществе. Второй источник радости – приключения и путешествия в компании единомышленников. Несмотря на напористость и прямолинейность восходящие Стрельцы окружены толпой друзей, привлеченных их оригинальностью мышления, бесстрашием и оптимизмом.;Луна: второе важнейшее светило, у женщин часто - первое. Луна собирает и преобразует энергию других планет, особенно Солнца. Повелительница инстинктов и эмоций. Планета настроений. Символ женского начала как зачатия и материнства - в отличие от Венеры как символа чувственной любви. Люди рожденные с Луной в знаке Стрельца независимы, открыты, щедры, позитивны, идеалистичны и оптимистичны – именно эти качества привлекают к ним большое количество друзей и знакомых. Вы любите путешествовать, коммуникабельны, общительны и можете выразить свое мнение.;Люди рожденные с Меркурием под знаком Стрельца обладают даром предвидения. Ваш ум зачастую занят большими идеями, планами и целями на будущее. Вы заинтересованы в том, чтобы достичь того, что виднеется на горизонте.;В любовных отношениях люди с Венерой в Стрельце ищут тех, с кем они могут расти, расширять свой кругозор и сознание. Вас привлекают веселые, игривые и открытые люди, готовые к новым приключениям и впечатлениям.;Люди рожденные с Марсом в Стрельце предприимчивые идеалисты, они следуют яркой и далекой звезде, планируют новые открытия и исследования, которые смогут расширить их горизонты.;Люди рожденные с Юпитером под знаком Стрельца обладают добрым сердцем, верные, щедрые, гуманные, обладают широким кругозором, терпеливые. Они на все смотрят с философской точки зрения.;Положительными чертами людей рожденных с Сатурном в Стрельце является хороший склад ума и желание принести пользу всему человечеству благодаря дисциплине, систематичности, умению оказать помощь.;;;
Козерог;Люди, рожденные под знаком Козерога, отличаются невероятной по своей силе целеустремленностью и стойкости к различного рода жизненным трудностям. Характеристика Солнечного Козерога являет собой воплощение силы и духа, будь то женщина или мужчина. Нет такой задачи, с которой бы не справился этот истинный представитель заемной стихии. В то же время они горды и самоуверенны, что нередко становится причиной конфликтов с окружающими и недопонимания в отношениях с близкими.;Обладатель Асцендента в Козероге – реалист, твердо стоящий на земле. Для него первостепенно высокое положение в обществе, ради чего он неустанно трудится и ограничивает себя в развлечениях и покупках. Достигнув цели, он вознаградит свое терпение покупкой недвижимости и земельных участков. Сдержанный в эмоциях и недоверчивый натив может расслабиться и сбросить защитную скорлупу только в уютной домашней обстановке.;Люди рожденные с Луной в знаке Козерога, серьезные и ответственные, они считают обязанности превыше всего. Вам неудобно показывать свои эмоции другим людям, и тем более, вы не хотите продемонстрировать, что нуждаетесь в помощи и поддержке. Вы не хотите выглядеть эмоционально слабыми. У вас высокие амбиции, быть может, потому что вы чувствуете себя нелюбимыми, нежеланными и несовершенными. Вы работаете очень усердно, потому что это позволяет вам испытать чувство важности или необходимости.;Люди рожденные с Меркурием в знаке Козерога наделены ясностью ума, дисциплинированностью, серьезностью, практичностью, организованностью, объективностью и трезвостью. Вас не впечатляют завышенные обещания.;Люди рожденные с Венерой в Козероге выражают свою любовь и привязанность обдуманно, бережно и со всей серьезностью. Вы не демонстрируете их открыто. Вы сильно озабочены тем, что о вас подумают люди.;Ваши поступки отражают амбиции к власти, признанию, почету и положению. Вы не хотите следовать за кем-либо. Вы хотите занимать главенствующую роль во всем, что делаете. Если не справляетесь, то способны стать жестоким манипулятором, который сносит любого, кто встанет на пути.;Люди рожденные с Юпитером в знаке Козерога, честные, искренние, преданные, изобретательные, находчивые и хорошо разбираются в разных механизмах. Ваши попытки роста, развития, поиска новых возможностей и желание преуспеть сочетаются с осторожностью.;Сатурн в знаке Козерога в вашей натальной карте, наделяет людей амбициями и способностью к самоконтролю и организации. Вы дисциплинированы, терпеливы, усердно работаете, за что получаете заслуженные поощрения.;;;
Водолей;Представитель знака Водолей может как никто другой удивить знакомых своей экстравагантностью и безумными выходками. Этот человек свободолюбив и любопытен, что не позволяет ему задерживаться подолгу на одном месте. Характеристика Водолея показывает что он до навязчивости дружелюбен, но не всегда обладает достаточной тактичностью, что становится помехой в общении с окружающими. Солнечный Водолей всегда стремится к новым приключениям, не сосредотачиваясь на чем-то одном. Из всех знаков Водолея можно характеризовать как самого непредсказуемого.;Он не может усидеть на одном месте, следуя за многообразием своих интересов, от древних цивилизаций до устройств современных гаджетов, и сетует, что в сутках лишь 24 часа. Если этот оптимист сталкивается с трудностями, то просто включает дополнительный резерв фантазии и находит способ решить проблему или уйти от наказания, когда в очередной раз нарушил какой-то закон. Для щедрого, небрежного и немного рассеянного подопечного Урана не существует границ в пространстве чужих миров.;Ваши эмоции, как правило, руководствуются разумом, и вы можете быть очень отстраненным, когда речь идет о борьбе чувствами. Другие могут думать, что вы холодны и отчуждены, не понимая ваших способов, с помощью которых вы справляетесь со своими эмоциями.;Мысли у людей с Меркурием в знаке Водолея, могут быть уникальными, необычными, быстрыми, эксцентричными, не шаблонными, научными, странными и, пожалуй, немного опережающими свое время. Вы являетесь прогрессивным и нетрадиционным мыслителем.;Свою привязанность люди, рожденные с Венерой под знаком Водолея в натальной карте, выражают открытым, нетрадиционным и только им свойственным способом. Для них очень типично участие в общественной деятельности, собирающей людей вместе.;Энергия у людей рожденных с Марсом в знаке Водолея, выражается уникальным и оригинальным способом. Вы можете быть даже гениальны в своем образе мышления. Вы изобретательны, увлекаетесь наукой, немного эксцентричны, нестандартны и, возможно, мятежны в своих мыслях.;Люди рожденные с Юпитером в знаке Козерога, честные, искренние, преданные, изобретательные, находчивые и хорошо разбираются в разных механизмах. Ваши попытки роста, развития, поиска новых возможностей и желание преуспеть сочетаются с осторожностью.;Люди рожденные с Сатурном в знаке Водолея обладают практичным здравым смыслом, самодисциплиной и внутренними источниками силы, обеспечивающими выносливость.;;;
